,paragraph
157,"Firenze slowed to a walk, warned Harry to keep his head bowed in case of low-hanging branches, but did not answer Harry's question. They made their way through the trees in silence for so long that Harry thought Firenze didn't want to talk to him anymore. They were passing through a particularly dense patch of trees, however, when Firenze suddenly stopped. "
158,"""Harry Potter, do you know what unicorn blood is used for?"" "
159,"""No,"" said Harry, startled by the odd question. ""We've only used the horn and tail hair in Potions."" "
160,"""That is because it is a monstrous thing, to slay a unicorn,"" said Firenze. ""Only one who has nothing to lose, and everything to gain, would commit such a crime. The blood of a unicorn will keep you alive, even if you are an inch from death, but at a terrible price. You have slain something pure and defenseless to save yourself, and you will have but a half-life, a cursed life, from the moment the blood touches your lips."" "
161,"Harry stared at the back of Firenze's head, which was dappled silver in the moonlight. "
162,"""But who'd be that desperate?"" he wondered aloud. ""If you're going to be cursed forever, death's better, isn't it?"" "
163,"""It is,"" Firenze agreed, ""unless all you need is to stay alive long enough to drink something else -- something that will bring you back to full strength and power -- something that will mean you can never die. Mr. Potter, do you know what is hidden in the school at this very moment?"" "
164,"""The Sorcerer's Stone! Of course -- the Elixir of Life! But I don't understand who --"" "
165,"""Can you think of nobody who has waited many years to return to power, who has clung to life, awaiting their chance?"" "
166,"It was as though an iron fist had clenched suddenly around Harry's heart. Over the rustling of the trees, he seemed to hear once more what Hagrid had told him on the night they had met: ""Some say he died. Codswallop, in my opinion. Dunno if he had enough human left in him to die."" "
167,"""Do you mean,"" Harry croaked, ""that was Vol- "" "
168,"""Harry! Harry, are you all right?"" "
169,"Hermione was running toward them down the path, Hagrid puffing along behind her. "
170,"""I'm fine,"" said Harry, hardly knowing what he was saying. ""The unicorn's dead, Hagrid, it's in that clearing back there."" "
171,"""This is where I leave you,"" Firenze murmured as Hagrid hurried off to examine the unicorn. ""You are safe now."" "
172,Harry slid off his back. 
173,"""Good luck, Harry Potter,"" said Firenze. ""The planets have been read wrongly before now, even by centaurs. I hope this is one of those times."" "
174,"He turned and cantered back into the depths of the forest, leaving Harry shivering behind him. "
175,"Ron had fallen asleep in the dark common room, waiting for them to return. He shouted something about Quidditch fouls when Harry roughly shook him awake. In a matter of seconds, though, he was wide-eyed as Harry began to tell him and Hermione what had happened in the forest. "
176,Harry couldn't sit down. He paced up and down in front of the fire. He was still shaking. 
177,"""Snape wants the stone for Voldemort... and Voldemort's waiting in the forest... and all this time we thought Snape just wanted to get rich..."" "
178,"""Stop saying the name!"" said Ron in a terrified whisper, as if he thought Voldemort could hear them. "
179,Harry wasn't listening. 
180,"""Firenze saved me, but he shouldn't have done so... Bane was furious... he was talking about interfering with what the planets say is going to happen... They must show that Voldemort's coming back... Bane thinks Firenze should have let Voldemort kill me... I suppose that's written in the stars as well."" "
181,"""Will you stop saying the name!"" Ron hissed. "
182,"""So all I've got to wait for now is Snape to steal the Stone,"" Harry went on feverishly, ""then Voldemort will be able to come and finish me off... Well, I suppose Bane'll be happy."" "
183,"Hermione looked very frightened, but she had a word of comfort. "
184,"""Harry, everyone says Dumbledore's the only one You-Know-Who was ever afraid of, with Dumbledore around, You-Know-Who won't touch you. Anyway, who says the centaurs are right? It sounds like fortune-telling to me, and Professor McGonagall says that's a very imprecise branch of magic."" "
185,"The sky had turned light before they stopped talking. They went to bed exhausted, their throats sore. But the night's surprises weren't over. "
186,"When Harry pulled back his sheets, he found his invisibility cloak folded neatly underneath them. There was a note pinned to it: "
187,Just in case. 
